{
  "counts": {
    "classifications": {
      "AMBIGUOUS": 0,
      "DEFAULTED": 2,
      "DERIVED": 2,
      "DROPPED": 18,
      "EXACT": 0,
      "INVALID_SOURCE": 0,
      "MERGED": 10,
      "NORMALIZED": 35,
      "PRESERVED_AS_EXTENSION": 0,
      "RENAMED": 0,
      "SPLIT": 0,
      "UNSUPPORTED": 2
    },
    "severities": {
      "ERROR": 0,
      "INFO": 0,
      "WARNING": 22
    }
  },
  "issues": [
    {
      "action": "Review the migration report.",
      "classification": "UNSUPPORTED",
      "code": "MIGRATION_FIELD_UNSUPPORTED",
      "destination_pointer": null,
      "issue_id": "mig_f6aae425ee395817c6ff",
      "message": "V2 block field 'audio_file' has no Phase 1 canonical destination.",
      "severity": "WARNING",
      "source_path": "/blocks/0/audio_file",
      "source_pointer": "/blocks/0/audio_file"
    },
    {
      "action": "Review the migration report.",
      "classification": "DROPPED",
      "code": "MIGRATION_FIELD_DROPPED",
      "destination_pointer": null,
      "issue_id": "mig_c7f5fcf8747955ea0e2f",
      "message": "V2 block field 'bgm_drop' has no Phase 1 canonical destination.",
      "severity": "WARNING",
      "source_path": "/blocks/0/bgm_drop",
      "source_pointer": "/blocks/0/bgm_drop"
    },
    {
      "action": "Review the migration report.",
      "classification": "DROPPED",
      "code": "MIGRATION_FIELD_DROPPED",
      "destination_pointer": null,
      "issue_id": "mig_7d49f833fdb828d798b1",
      "message": "V2 block field 'pause_after' has no Phase 1 canonical destination.",
      "severity": "WARNING",
      "source_path": "/blocks/0/pause_after",
      "source_pointer": "/blocks/0/pause_after"
    },
    {
      "action": "Review the migration report.",
      "classification": "DROPPED",
      "code": "MIGRATION_FIELD_DROPPED",
      "destination_pointer": null,
      "issue_id": "mig_b81dae9b2f03ef0513b5",
      "message": "V2 block field 'pause_before' has no Phase 1 canonical destination.",
      "severity": "WARNING",
      "source_path": "/blocks/0/pause_before",
      "source_pointer": "/blocks/0/pause_before"
    },
    {
      "action": "Review the migration report.",
      "classification": "DROPPED",
      "code": "MIGRATION_FIELD_DROPPED",
      "destination_pointer": null,
      "issue_id": "mig_46dcba2f2203a3672101",
      "message": "V2 visual field 'fit_mode' has no Phase 1 canonical destination.",
      "severity": "WARNING",
      "source_path": "/blocks/0/visuals/0/fit_mode",
      "source_pointer": "/blocks/0/visuals/0/fit_mode"
    },
    {
      "action": "Review the migration report.",
      "classification": "DROPPED",
      "code": "MIGRATION_FIELD_DROPPED",
      "destination_pointer": null,
      "issue_id": "mig_e33b1e386ceccc8b72b2",
      "message": "V2 visual field 'subtitle_policy' has no Phase 1 canonical destination.",
      "severity": "WARNING",
      "source_path": "/blocks/0/visuals/0/subtitle_policy",
      "source_pointer": "/blocks/0/visuals/0/subtitle_policy"
    },
    {
      "action": "Review the migration report.",
      "classification": "DROPPED",
      "code": "MIGRATION_FIELD_DROPPED",
      "destination_pointer": null,
      "issue_id": "mig_fd4acbc1f79a9f0adb7b",
      "message": "V2 visual field 'transition_out' has no Phase 1 canonical destination.",
      "severity": "WARNING",
      "source_path": "/blocks/0/visuals/0/transition_out",
      "source_pointer": "/blocks/0/visuals/0/transition_out"
    },
    {
      "action": "Review the migration report.",
      "classification": "DROPPED",
      "code": "MIGRATION_FIELD_DROPPED",
      "destination_pointer": null,
      "issue_id": "mig_4ea6e56b40131ed0b278",
      "message": "V2 visual field 'fit_mode' has no Phase 1 canonical destination.",
      "severity": "WARNING",
      "source_path": "/blocks/0/visuals/1/fit_mode",
      "source_pointer": "/blocks/0/visuals/1/fit_mode"
    },
    {
      "action": "Review the migration report.",
      "classification": "DEFAULTED",
      "code": "MIGRATION_FIELD_DEFAULTED",
      "destination_pointer": "/sequences/0/edit_events/1",
      "issue_id": "mig_99f821523ea25792d4f0",
      "message": "AUTO has no frame value in the Phase 1 semantic cue model.",
      "severity": "WARNING",
      "source_path": "/blocks/0/visuals/1/offset_end",
      "source_pointer": "/blocks/0/visuals/1/offset_end"
    },
    {
      "action": "Review the migration report.",
      "classification": "DROPPED",
      "code": "MIGRATION_FIELD_DROPPED",
      "destination_pointer": null,
      "issue_id": "mig_4e14cf9b55000ed1b8d9",
      "message": "V2 visual field 'subtitle_policy' has no Phase 1 canonical destination.",
      "severity": "WARNING",
      "source_path": "/blocks/0/visuals/1/subtitle_policy",
      "source_pointer": "/blocks/0/visuals/1/subtitle_policy"
    },
    {
      "action": "Review the migration report.",
      "classification": "DROPPED",
      "code": "MIGRATION_FIELD_DROPPED",
      "destination_pointer": null,
      "issue_id": "mig_c5da8a45b26ce9e44684",
      "message": "V2 visual field 'transition_out' has no Phase 1 canonical destination.",
      "severity": "WARNING",
      "source_path": "/blocks/0/visuals/1/transition_out",
      "source_pointer": "/blocks/0/visuals/1/transition_out"
    },
    {
      "action": "Review the migration report.",
      "classification": "UNSUPPORTED",
      "code": "MIGRATION_FIELD_UNSUPPORTED",
      "destination_pointer": null,
      "issue_id": "mig_bece61ab49bef4707459",
      "message": "V2 block field 'audio_file' has no Phase 1 canonical destination.",
      "severity": "WARNING",
      "source_path": "/blocks/1/audio_file",
      "source_pointer": "/blocks/1/audio_file"
    },
    {
      "action": "Review the migration report.",
      "classification": "DROPPED",
      "code": "MIGRATION_FIELD_DROPPED",
      "destination_pointer": null,
      "issue_id": "mig_8a6f447b779bfccf0744",
      "message": "V2 block field 'bgm_drop' has no Phase 1 canonical destination.",
      "severity": "WARNING",
      "source_path": "/blocks/1/bgm_drop",
      "source_pointer": "/blocks/1/bgm_drop"
    },
    {
      "action": "Review the migration report.",
      "classification": "DROPPED",
      "code": "MIGRATION_FIELD_DROPPED",
      "destination_pointer": null,
      "issue_id": "mig_b3785da45157e18d8c40",
      "message": "V2 block field 'pause_after' has no Phase 1 canonical destination.",
      "severity": "WARNING",
      "source_path": "/blocks/1/pause_after",
      "source_pointer": "/blocks/1/pause_after"
    },
    {
      "action": "Review the migration report.",
      "classification": "DROPPED",
      "code": "MIGRATION_FIELD_DROPPED",
      "destination_pointer": null,
      "issue_id": "mig_1102936f339f16ebc34e",
      "message": "V2 block field 'pause_before' has no Phase 1 canonical destination.",
      "severity": "WARNING",
      "source_path": "/blocks/1/pause_before",
      "source_pointer": "/blocks/1/pause_before"
    },
    {
      "action": "Review the migration report.",
      "classification": "DROPPED",
      "code": "MIGRATION_FIELD_DROPPED",
      "destination_pointer": null,
      "issue_id": "mig_6fd2323749b8984f95dd",
      "message": "V2 visual field 'fit_mode' has no Phase 1 canonical destination.",
      "severity": "WARNING",
      "source_path": "/blocks/1/visuals/0/fit_mode",
      "source_pointer": "/blocks/1/visuals/0/fit_mode"
    },
    {
      "action": "Review the migration report.",
      "classification": "DROPPED",
      "code": "MIGRATION_FIELD_DROPPED",
      "destination_pointer": null,
      "issue_id": "mig_039b101a4068496de1b4",
      "message": "V2 visual field 'subtitle_policy' has no Phase 1 canonical destination.",
      "severity": "WARNING",
      "source_path": "/blocks/1/visuals/0/subtitle_policy",
      "source_pointer": "/blocks/1/visuals/0/subtitle_policy"
    },
    {
      "action": "Review the migration report.",
      "classification": "DROPPED",
      "code": "MIGRATION_FIELD_DROPPED",
      "destination_pointer": null,
      "issue_id": "mig_fa2fa572405f8e782921",
      "message": "V2 visual field 'transition_out' has no Phase 1 canonical destination.",
      "severity": "WARNING",
      "source_path": "/blocks/1/visuals/0/transition_out",
      "source_pointer": "/blocks/1/visuals/0/transition_out"
    },
    {
      "action": "Review the migration report.",
      "classification": "DROPPED",
      "code": "MIGRATION_FIELD_DROPPED",
      "destination_pointer": null,
      "issue_id": "mig_74a84d31dbae41754b4a",
      "message": "V2 visual field 'fit_mode' has no Phase 1 canonical destination.",
      "severity": "WARNING",
      "source_path": "/blocks/1/visuals/1/fit_mode",
      "source_pointer": "/blocks/1/visuals/1/fit_mode"
    },
    {
      "action": "Review the migration report.",
      "classification": "DEFAULTED",
      "code": "MIGRATION_FIELD_DEFAULTED",
      "destination_pointer": "/sequences/1/edit_events/1",
      "issue_id": "mig_32709f2e40697aa4e7b7",
      "message": "AUTO has no frame value in the Phase 1 semantic cue model.",
      "severity": "WARNING",
      "source_path": "/blocks/1/visuals/1/offset_end",
      "source_pointer": "/blocks/1/visuals/1/offset_end"
    },
    {
      "action": "Review the migration report.",
      "classification": "DROPPED",
      "code": "MIGRATION_FIELD_DROPPED",
      "destination_pointer": null,
      "issue_id": "mig_a81335126e900895f34e",
      "message": "V2 visual field 'subtitle_policy' has no Phase 1 canonical destination.",
      "severity": "WARNING",
      "source_path": "/blocks/1/visuals/1/subtitle_policy",
      "source_pointer": "/blocks/1/visuals/1/subtitle_policy"
    },
    {
      "action": "Review the migration report.",
      "classification": "DROPPED",
      "code": "MIGRATION_FIELD_DROPPED",
      "destination_pointer": null,
      "issue_id": "mig_316054fd400a9df89c5e",